{
  "capabilities": [],
  "enforcement_coverage": {
    "mcp": "L1"
  },
  "findings": [],
  "inventory_summary": {
    "skill": 1
  },
  "policy_decisions": [],
  "provenance_coverage": {
    "artifacts": {
      "covered": 1,
      "total": 1
    }
  },
  "residual_risks": [
    "OS process isolation not enabled"
  ],
  "schema_version": "1.0.0",
  "scope": {
    "workspace": "fixture"
  }
}
